Date,Date__,DOY,ALD_palsa_135,WTD_palsa_135,ALD_bog_246,WTD_bog_246,ALD_fen_78,WTD_fen_78,ALD_tussok_9,WTD_tussok_9,ALD_bog_E,WTD_bog_E,ALD_bog_F,WTD_bog_F,staffgauge.m,ALD_palsa_center,WTD_palsa_center
6/18/2003,2003-06-18,169,-21,,,,,,,,-36,-5,,,,,
6/20/2003,2003-06-20,171,-25,,,,,,,,-35,-7,,,,,
6/22/2003,2003-06-22,173,-25,,,,,,,,-36,-6,,,,,
6/25/2003,2003-06-25,176,-25,,,,,,,,-37,-9,,,,,
6/27/2003,2003-06-27,178,-26,,,,,,,,-35,-11,,,,,
6/29/2003,2003-06-29,180,-29,0,-32,-20,-90,-4,,,-38,-12,,,,,
7/2/2003,2003-07-02,183,-26,0,-32,-20,-90,0,,,-42,-9,,,,,
7/4/2003,2003-07-04,185,-30,0,-34,-20,-105,0,,,-40,-12,,,,,
7/6/2003,2003-07-06,187,-30,0,-36,-20,-120,0,,,-43,-14,,,,,
7/9/2003,2003-07-09,190,-30,0,-37,-20,-120,1,,,-43,-6,,,,,
7/11/2003,2003-07-11,192,-30,0,-38,-20,>130,1,,,-43,-7,,,,,
7/13/2003,2003-07-13,194,-32,0,-39,-20,>130,1,,,-45,-10,,,,,
7/16/2003,2003-07-16,197,-33,0,-42,-17,>130,1,,,-45,-5,,,,,
7/20/2003,2003-07-20,201,-39,0,-42.5,-21,>130,-4,-44,-12,-47,-8,-42.5,-15,,,
7/25/2003,2003-07-25,206,-40,0,-43,-20,>130,-4,-102,-10,-49,-7,-44,-14,,,
7/27/2003,2003-07-27,208,-38,0,-44,-17,>130,-3,-116,-9,-53,-5,-46,-11,,,
8/1/2003,2003-08-01,213,-42,0,-47,-19,>130,-4,-115,-11,-55,-6,-49,-13,,,
8/6/2003,2003-08-06,218,-44,0,-50,-15,>130,-5,-115,-10,-83,-5,-50,-12,,,
8/8/2003,2003-08-08,220,-44,0,-52,-15,>130,-4,-115,-9,>130,-5,-52,-11,,,
8/10/2003,2003-08-10,222,-45,0,-51,-16,>130,-5,-115,-12,>130,-7,-52,-13,,,
8/14/2003,2003-08-14,226,-46,0,-52,-18,>130,-5,-120,-13,>130,-7,-53,-13,,,
8/16/2003,2003-08-16,228,-49,0,-54,-20,>130,-7,>130,-15,>130,-8,-53,-14,,,
8/20/2003,2003-08-20,232,-49,0,-56,-22,>130,-5,>130,-17,>130,-11,-55,-15,,,
8/24/2003,2003-08-24,236,-56,0,-57,-25,>130,-9,>130,-18,>130,-13,-55,-17,,,
8/27/2003,2003-08-27,239,-52,0,-58,-18,>130,-5,>130,-12,>130,-6,-58,-13,,,
8/31/2003,2003-08-31,243,-54,0,-58,-16,>130,-6,>130,-13,>130,-7,-59,-11,,,
6/5/2004,2004-06-05,157,-21,0,-25,-26,-21.5,-4.5,-27.5,-13,-26,-16.5,-27,-10,,,
6/7/2004,2004-06-07,159,-22,0,-25,-17.5,-20,-2.5,-27,-7.5,-32,-5,-27,-15,,,
6/9/2004,2004-06-09,161,-22,0,-24,-19.5,-20,-7,-27,-4,-32,-5,-28,-15,,,
6/11/2004,2004-06-11,163,-23,0,-24,-21.5,-23,-4,-28,-8,-31,-5,-28,-15,,,
6/14/2004,2004-06-14,166,-25,0,-26,-22,-24,-5,-30,-9.5,-31,-8,-30,-16,,,
6/16/2004,2004-06-16,168,-24,0,-28,-18.5,-26,-4,-30,-8,-31,-5,-34,-10,,,
6/22/2004,2004-06-22,174,-27,0,-30,-23,-28,-3,-30,-7,-31,-4,-31,-16,,,
6/24/2004,2004-06-24,176,-27,0,-28,-21,-28,-4,-32,-10,-31,-5,-31,-14,,,
6/28/2004,2004-06-28,180,-25,0,-30,-21,-30,-4,-90,-8,-32,-7,-33,-15,,,
6/30/2004,2004-06-30,182,-26,0,-32,-14,-32,-1,>90,-2,-34,-1,-34,-8,,,
7/2/2004,2004-07-02,184,-32,0,-35,-9,-34,0,>90,-7,-37,0,-36,-8,,,
7/5/2004,2004-07-05,187,-32,0,-36,-9,-37,0,>90,-5,-46,0,-40,-8,,,
7/7/2004,2004-07-07,189,-32,0,-38,-8,-38,-1,>90,-3,-46,5,-40,-5,,,
7/14/2004,2004-07-14,196,-33,0,-40,-1,-90,-7,>90,-5,-55,13,-42,3,,,
7/17/2004,2004-07-17,199,-38,0,-44,-5,>90,-2,>90,-4,-60,5,-45,-4,,,
7/18/2004,2004-07-18,200,-37,0,-46,-8,>90,-1,>90,-7,-58,3,-45,-8,,,
7/21/2004,2004-07-21,203,-37,0,-50,-2,>90,-10,>90,-2,-60,7,-47,-7,,,
7/23/2004,2004-07-23,205,-39,0,-46,-5,>90,-4,>90,-5,-60,3,-49,-5,,,
7/26/2004,2004-07-26,208,-42,0,-49,-8,>90,-2,>90,-8,-90,1,-51,-8,,,
7/28/2004,2004-07-28,210,-42,0,-56,-5,>90,-2,>90,-4,>90,2,-50,-5,,,
7/30/2004,2004-07-30,212,-42,0,-54,-8,>90,0,>90,-8,>90,0,-54,-6,,,
8/4/2004,2004-08-04,217,-48,0,-54,-10,>90,0,>90,-9,>90,0,-80,-8,,,
8/11/2004,2004-08-11,224,-52,0,-54,-8.5,>90,0,>90,-8,>90,0,-90,-8,,,
8/14/2004,2004-08-14,227,-54,0,-57,-8,>90,0,>90,-7,>90,-1,>90,-8,,,
8/27/2004,2004-08-27,240,-57,0,-90,-9.5,>90,0,>90,-11,>90,0,>90,-9.5,,,
8/29/2004,2004-08-29,242,-58,0,>90,-9.5,>90,0,>90,-11,>90,0,>90,-9.5,,,
5/28/2005,2005-05-28,148,-12,0,-10,-8,-2,5,-8,-4,,,,,,,
6/14/2005,2005-06-14,165,-18,0,-16,-8,-18,5,-17,-5,-22,0,-19,-6,,,
6/15/2005,2005-06-15,166,-25,0,-27,-7,-60,7,-25,-7,-39,0,-29,-7,,,
6/16/2005,2005-06-16,167,-25,0,-28,-7.5,-90,,-27,,-40,0,-29,-9,,,
6/17/2005,2005-06-17,168,-27,0,-28,-8.5,>90,5,-27,-8,-39,-1,-30,-8,,,
6/18/2005,2005-06-18,169,-28,0,-28,-9,>90,5,-28,-7.5,-39,-1.5,-30,-8.5,,,
6/19/2005,2005-06-19,170,-28,0,-29,-9,>90,3,-29,-9,-39,-2.5,-31,-9,,,
6/21/2005,2005-06-21,172,-28,0,-29,-9.5,>90,5,-30,-9,-40,-3,-31,-10,,,
6/23/2005,2005-06-23,174,-29,0,-30,-11.5,>90,5,-31,-10.5,-40,-5,-32,-11,,,
6/25/2005,2005-06-25,176,-30,0,-31,-11.5,>90,3.5,-33,-10,-41,-4,-34,-11,,,
6/29/2005,2005-06-29,180,-31,0,-33,-6,>90,4,-75,,-44,0.5,-36,-6,,,
7/1/2005,2005-07-01,182,-32,0,-34,-7,>90,4,-75,-8.5,-47,-1,-40,-7,,,
7/6/2005,2005-07-06,187,-33,0,-35,-8.5,>90,4.5,-90,-10.5,-48,-3,-45,-8.5,,,
7/8/2005,2005-07-08,189,-33,0,-39,-17,>90,2,>90,-10.5,-90,-8,-48,-18,,,
7/13/2005,2005-07-13,194,-33,0,-40,-17,>90,0,>90,-19,>90,-12,-50,-17,,,
7/14/2005,2005-07-14,195,-37,0,-43,-20,>90,-1,>90,-8,>90,-10,-90,-20,,,
7/16/2005,2005-07-16,197,-37,0,-42,-19.5,>90,-1,>90,-8,>90,-10,>90,-20,,,
7/19/2005,2005-07-19,200,-38,0,-45,-20,>90,-2,>90,-19.5,>90,-10,>90,-20,,,
7/21/2005,2005-07-21,202,-38,0,-45,-19,>90,-2,>90,-19.5,>90,-11,>90,-20,,,
7/24/2005,2005-07-24,205,-39,0,-46,-20.5,>90,-1,>90,-20,>90,-14,>90,-20.5,,,
7/25/2005,2005-07-25,206,-39,0,-49,-20,>90,3,>90,-25,>90,-17,>90,-23,,,
7/26/2005,2005-07-26,207,-39,0,-70,-16,>90,5,>90,-17,>90,-13,>90,-17,,,
7/28/2005,2005-07-28,209,-41,0,-80,-11,>90,-1,>90,-12.5,>90,-8,>90,-13,,,
7/30/2005,2005-07-30,211,-42,0,-90,-12.5,>90,-1,>90,-14,>90,-7.5,>90,-14,,,
8/2/2005,2005-08-02,214,-43,0,>90,-5.5,>90,-2,>90,-9,>90,-1,>90,-7.5,,,
8/3/2005,2005-08-03,215,-43,0,>90,-8,>90,0,>90,-9,>90,0,>90,-8,,,
8/4/2005,2005-08-04,216,-44,0,>90,-7.5,>90,-2,>90,-10,>90,-1,>90,-9,,,
8/5/2005,2005-08-05,217,-45,0,>90,-8,>90,-3,>90,-12,>90,-2,>90,-10.5,,,
8/6/2005,2005-08-06,218,-45,0,>90,-8,>90,-2.5,>90,-11.5,>90,-1.5,>90,-10.5,,,
8/9/2005,2005-08-09,221,-46,0,>90,-4.5,>90,-1,>90,-7.5,>90,-1,>90,-5.5,,,
8/11/2005,2005-08-11,223,-47,0,>90,-5.5,>90,-2,>90,-10,>90,-1,>90,-8,,,
8/16/2005,2005-08-16,228,-47,0,>90,-6.5,>90,-3,>90,-10,>90,-1,>90,-10,,,
8/17/2005,2005-08-17,229,-50,0,>90,-5,>90,-1,>90,-8.5,>90,-1,>90,-7.5,,,
8/22/2005,2005-08-22,234,-52,0,>90,-8,>90,0,>90,-12,>90,-3,>90,-10,,,
8/23/2005,2005-08-23,235,-52,0,>90,-8,>90,0,>90,-10,>90,-4,>90,-10,,,
8/24/2005,2005-08-24,236,-53,0,>90,-5,>90,0,>90,-8,>90,-2,>90,-8,,,
8/28/2005,2005-08-28,240,-54.5,0,>90,-2,>90,0,>90,-4,>90,2,>90,-5,,,
9/6/2005,2005-09-06,249,-59,0,>90,-7,>90,0,>90,-10,>90,-10,>90,-3,,,
9/7/2005,2005-09-07,250,-59,0,>90,-7,>90,0,>90,-9,>90,-9,>90,-3,,,
9/9/2005,2005-09-09,252,-59,0,-90,-3,>90,1,>90,-5,>90,-5,>90,0,,,
5/3/2006,2006-05-03,123,-9,,-11,-7,-5,0,-11,0,,,,,,,
5/5/2006,2006-05-05,125,-9,0,-11,-7,-5,0,-11,0,,,,,,,
5/24/2006,2006-05-24,144,-17,,-27,-9.5,-20,-3,,-1.8,,-2.7,,-9,,,
5/25/2006,2006-05-25,145,-16.2,,-24.7,-10.4,-19.6,-3.3,-19.6,-2,-29,-1.5,-26.9,-7.9,,,
5/26/2006,2006-05-26,146,-18.5,,-25,-9.5,-18,-3,-22,-2.8,-30.5,-1.5,-27,-7,,,
5/26/2006,2006-05-26,146,-17,0,-27,-9.5,-20,-3,,-1.8,,-2.7,,-9,,,
5/27/2006,2006-05-27,147,-16.2,0,-24.7,-10.4,-19.6,-3.3,-19.6,-2,-29,-1.5,-26.9,-7.9,,,
5/28/2006,2006-05-28,148,-18.5,0,-25,-9.5,-18,-3,-22,-2.8,-30.5,-1.5,-27,-7,,,
6/12/2006,2006-06-12,163,,,,,,,,,,,,,,,
6/13/2006,2006-06-13,164,-23.4,,-29.2,-11.1,-28.6,-0.8,-30.3,-6.8,-36.5,-4.5,-30.4,-11.3,,,
6/14/2006,2006-06-14,165,-23.5,,-29.2,-13.2,-27,-1.4,-31.5,-7.2,-36.3,-5.3,-30.4,-10.4,,,
6/15/2006,2006-06-15,166,-25.1,,-29.4,-14.6,-27.3,-0.9,-30.4,-7,-35.3,-5.8,-30.2,-10.1,,,
6/15/2006,2006-06-15,166,-23.4,0,-29.2,-11.1,-28.6,-0.8,-30.3,-6.8,-36.5,-4.5,-30.4,-11.3,,,
6/16/2006,2006-06-16,167,-24.7,,-30.2,-14.9,-28.4,-0.2,-31.4,-7.2,-34.7,-6,-30.7,-10.6,,,
6/16/2006,2006-06-16,167,-23.5,0,-29.2,-13.2,-27,-1.4,-31.5,-7.2,-36.3,-5.3,-30.4,-10.4,,,
6/17/2006,2006-06-17,168,-25.1,0,-29.4,-14.6,-27.3,-0.9,-30.4,-7,-35.3,-5.8,-30.2,-10.1,,,
6/17/2006,2006-06-17,168,-25,,-30.7,-15.6,-29.3,-0.2,-31.2,-7.3,-35.3,-6.3,-31.3,-10.4,,,
6/18/2006,2006-06-18,169,-24.7,0,-30.2,-14.9,-28.4,-0.2,-31.4,-7.2,-34.7,-6,-30.7,-10.6,,,
6/18/2006,2006-06-18,169,,,,,,,,,,,,,,,
6/19/2006,2006-06-19,170,-25,,-31.2,-14,-31.2,0,-32.2,-6.4,-36.2,-5.5,-32.2,-8,,,
6/19/2006,2006-06-19,170,-25,0,-30.7,-15.6,-29.3,-0.2,-31.2,-7.3,-35.3,-6.3,-31.3,-10.4,,,
6/20/2006,2006-06-20,171,-25.3,,-32,-14.2,-32.5,0,-33,-6.7,-37.5,-5.7,-33.2,-9.6,,,
6/21/2006,2006-06-21,172,-25.6,,-34.6,-10.2,-34.3,0.3,-33,-4.3,-40.5,-4.2,-34,-6.7,,,
6/21/2006,2006-06-21,172,-25,0,-31.2,-14,-31.2,0,-32.2,-6.4,-36.2,-5.5,-32.2,-8,,,
6/22/2006,2006-06-22,173,-26.3,,-33.7,-9,-34,0.3,-34.5,-2.9,-41.5,-0.3,-34.3,-4.5,,,
6/22/2006,2006-06-22,173,-25.3,0,-32,-14.2,-32.5,0,-33,-6.7,-37.5,-5.7,-33.2,-9.6,,,
6/23/2006,2006-06-23,174,-26.8,,-34.4,-7.6,34.7,0.5,-35,-2.7,-41.5,0,-35.3,-3.6,,,
6/23/2006,2006-06-23,174,-25.6,0,-34.6,-10.2,-34.3,0.3,-33,-4.3,-40.5,-4.2,-34,-6.7,,,
6/24/2006,2006-06-24,175,-26.3,0,-33.7,-9,-34,0.3,-34.5,-2.9,-41.5,-0.3,-34.3,-4.5,,,
6/24/2006,2006-06-24,175,,,,,,,,,,,,,,,
6/25/2006,2006-06-25,176,-26.8,0,-34.4,-7.6,34.7,0.5,-35,-2.7,-41.5,0,-35.3,-3.6,,,
6/25/2006,2006-06-25,176,,,,,,,,,,,,,,,
6/26/2006,2006-06-26,177,-28.4,,-35.9,-6.5,-37.7,0.8,-38.1,-2.4,-46,0.6,-35.8,-3.2,,,
6/27/2006,2006-06-27,178,-28.8,,-36.7,-7,-38.7,0.3,-38.1,-1.8,-44.5,0.2,-36.5,-3.7,,,
6/28/2006,2006-06-28,179,-28.9,,-37.6,-7.8,-40,0.2,-39,-2.9,-45.9,-0.2,-37,-4.4,,,
6/28/2006,2006-06-28,179,-28.4,0,-35.9,-6.5,-37.7,0.8,-38.1,-2.4,-46,0.6,-35.8,-3.2,,,
6/29/2006,2006-06-29,180,-28.8,,-38.2,-8.7,-36.5,0.2,-39.6,-3.4,-45.5,-1,-38,-5,,,
6/29/2006,2006-06-29,180,-28.8,0,-36.7,-7,-38.7,0.3,-38.1,-1.8,-44.5,0.2,-36.5,-3.7,,,
6/30/2006,2006-06-30,181,-29,,-38.2,-9.8,-37.2,0.1,-41,-4.2,-46.2,-1.3,-38.3,-5.6,,,
6/30/2006,2006-06-30,181,-28.9,0,-37.6,-7.8,-40,0.2,-39,-2.9,-45.9,-0.2,-37,-4.4,,,
7/1/2006,2006-07-01,182,-28.8,0,-38.2,-8.7,-36.5,0.2,-39.6,-3.4,-45.5,-1,-38,-5,,,
7/1/2006,2006-07-01,182,,,,,,,,,,,,,,,
7/2/2006,2006-07-02,183,-29,0,-38.2,-9.8,-37.2,0.1,-41,-4.2,-46.2,-1.3,-38.3,-5.6,,,
7/2/2006,2006-07-02,183,,,,,,,,,,,,,,,
7/3/2006,2006-07-03,184,,,,,,,,,,,,,,,
7/4/2006,2006-07-04,185,-31.7,,-40.1,-9.8,>90,0.1,-45.2,-4.8,-48.2,-2.3,-41,-4.7,,,
7/5/2006,2006-07-05,186,-31.7,,-41,-10.5,>90,-0.3,>90,-5.7,-46.5,-2.3,-41,-6,,,
7/6/2006,2006-07-06,187,-32.2,,-41.5,-11,>90,-0.2,>90,-5.4,-47,-3.1,-41.7,-6.7,,,
7/6/2006,2006-07-06,187,-31.7,0,-40.1,-9.8,>90,0.1,-45.2,-4.8,-48.2,-2.3,-41,-4.7,,,
7/7/2006,2006-07-07,188,-31.7,0,-41,-10.5,>90,-0.3,>90,-5.7,-46.5,-2.3,-41,-6,,,
7/7/2006,2006-07-07,188,,,,,,,,,,,,,,,
7/8/2006,2006-07-08,189,-32.2,0,-41.5,-11,>90,-0.2,>90,-5.4,-47,-3.1,-41.7,-6.7,,,
7/8/2006,2006-07-08,189,,,,,,,,,,,,,,,
7/9/2006,2006-07-09,190,,,,,,,,,,,,,,,
7/10/2006,2006-07-10,191,,,,,,,,,,,,,,,
7/11/2006,2006-07-11,192,-33.3,,-45.5,-5.8,>90,0.5,>90,-1.7,-53.2,0.7,-44.3,-2.8,,,
7/12/2006,2006-07-12,193,-34.8,,-45.5,-5.9,,0.4,,-2.1,-53.5,0.5,-44.3,-2.9,,,
7/13/2006,2006-07-13,194,-36.9,,-45.6,-4.3,,1.7,,-0.3,-54.8,2.6,-57.3,-1.2,,,
7/13/2006,2006-07-13,194,-33.3,0,-45.5,-5.8,>90,0.5,>90,-1.7,-53.2,0.7,-44.3,-2.8,,,
7/14/2006,2006-07-14,195,-37.3,,-47,-5.4,,0.9,,-2.4,-54.6,0.7,-57.3,-2.7,,,
7/14/2006,2006-07-14,195,-34.8,0,-45.5,-5.9,>90,0.4,>90,-2.1,-53.5,0.5,-44.3,-2.9,,,
7/15/2006,2006-07-15,196,-36.9,0,-45.6,-4.3,>90,1.7,>90,-0.3,-54.8,2.6,-57.3,-1.2,,,
7/15/2006,2006-07-15,196,,,,,,,,,,,,,,,
7/16/2006,2006-07-16,197,-37.3,0,-47,-5.4,>90,0.9,>90,-2.4,-54.6,0.7,-57.3,-2.7,,,
7/16/2006,2006-07-16,197,,,,,,,,,,,,,,,
7/17/2006,2006-07-17,198,-36.5,,-47.7,-7,,0,,-3.1,-56.4,0,-46.5,-3.6,,,
7/18/2006,2006-07-18,199,-36,,-47,-7.3,,-0.2,,-3,-57.5,-0.2,-47,-3.5,,,
7/19/2006,2006-07-19,200,-36.5,0,-47.7,-7,>90,0,>90,-3.1,-56.4,0,-46.5,-3.6,,,
7/19/2006,2006-07-19,200,-36.2,,-48,-8,,-0.5,,-3.9,-57.2,-0.5,-47.5,-4.2,,,
7/20/2006,2006-07-20,201,-36.2,,-48.2,-8.7,,-0.5,,-4.5,-57.5,-1,-47,-4.9,,,
7/20/2006,2006-07-20,201,-36,0,-47,-7.3,>90,-0.2,>90,-3,-57.5,-0.2,-47,-3.5,,,
7/21/2006,2006-07-21,202,-36.3,,-48.7,-9.5,,-0.2,,-4.9,-56.5,-1.6,-47.5,-5.6,,,
7/21/2006,2006-07-21,202,-36.2,0,-48,-8,>90,-0.5,>90,-3.9,-57.2,-0.5,-47.5,-4.2,,,
7/22/2006,2006-07-22,203,-36.2,0,-48.2,-8.7,>90,-0.5,>90,-4.5,-57.5,-1,-47,-4.9,,,
7/22/2006,2006-07-22,203,,,,,,,,,,,,,,,
7/23/2006,2006-07-23,204,-36.3,0,-48.7,-9.5,>90,-0.2,>90,-4.9,-56.5,-1.6,-47.5,-5.6,,,
7/23/2006,2006-07-23,204,,,,,,,,,,,,,,,
7/24/2006,2006-07-24,205,-37.1,,-48.8,-11,,-0.8,,-6.2,-57,-3,-48.5,-7,,,
7/25/2006,2006-07-25,206,-37.2,,-48.8,-12.3,,-1,,-7.6,-58.5,-4.7,-48,-7.8,,,
7/26/2006,2006-07-26,207,-38.6,,-49.2,-12.6,,-1.3,,-8.7,-55.9,-4.8,-48.2,-9.1,,,
7/26/2006,2006-07-26,207,-37.1,0,-48.8,-11,>90,-0.8,>90,-6.2,-57,-3,-48.5,-7,,,
7/27/2006,2006-07-27,208,-38.6,,-49.5,-13.7,,-1.4,,-8.2,-57.4,-5.2,-49.8,-9.4,0.4,,
7/27/2006,2006-07-27,208,-37.2,0,-48.8,-12.3,>90,-1,>90,-7.6,-58.5,-4.7,-48,-7.8,,,
7/28/2006,2006-07-28,209,-38.6,,-50,-14.2,,-1.6,,-9.4,-56.9,-6.1,-49.5,-10.7,0.52,,
7/28/2006,2006-07-28,209,-38.6,0,-49.2,-12.6,>90,-1.3,>90,-8.7,-55.9,-4.8,-48.2,-9.1,,,
7/29/2006,2006-07-29,210,-38.6,0,-49.5,-13.7,>90,-1.4,>90,-8.2,-57.4,-5.2,-49.8,-9.4,,,
7/29/2006,2006-07-29,210,,,,,,,,,,,,,,,
7/30/2006,2006-07-30,211,-38.6,0,-50,-14.2,>90,-1.6,>90,-9.4,-56.9,-6.1,-49.5,-10.7,,,
7/30/2006,2006-07-30,211,,,,,,,,,,,,,,,
7/31/2006,2006-07-31,212,-39.1,,-50.3,-15.9,,-1.8,,-11.2,-57.2,-8.5,-51.7,-12.6,,,
8/1/2006,2006-08-01,213,-39.5,,-51,-15.9,,-2,,-12.1,-58,-9.4,-51.7,-14.9,,,
8/2/2006,2006-08-02,214,-41.2,,-51.6,-16,,-1.8,,-12.8,-58,-9.9,-51.4,-14.6,,,
8/2/2006,2006-08-02,214,-39.1,0,-50.3,-15.9,>90,-1.8,>90,-11.2,-57.2,-8.5,-51.7,-12.6,,,
8/3/2006,2006-08-03,215,-41.2,,-52,-17.9,,-2,,-13,-58.3,-10.4,-51.9,-14.7,0.49,,
8/3/2006,2006-08-03,215,-39.5,0,-51,-15.9,>90,-2,>90,-12.1,-58,-9.4,-51.7,-14.9,,,
8/4/2006,2006-08-04,216,-41.5,,-52.4,-19,,-2.4,,-12.8,-58.5,-11,-52.2,-15.3,,,
8/4/2006,2006-08-04,216,-41.2,0,-51.6,-16,>90,-1.8,>90,-12.8,-58,-9.9,-51.4,-14.6,,,
8/5/2006,2006-08-05,217,-41.2,0,-52,-17.9,>90,-2,>90,-13,-58.3,-10.4,-51.9,-14.7,,,
8/5/2006,2006-08-05,217,,,,,,,,,,,,,,,
8/6/2006,2006-08-06,218,-41.5,0,-52.4,-19,>90,-2.4,>90,-12.8,-58.5,-11,-52.2,-15.3,,,
8/6/2006,2006-08-06,218,,,,,,,,,,,,,,,
8/7/2006,2006-08-07,219,-41.5,,-53.8,-20.3,,-2.2,,-14.7,>90,-11.9,-52.3,-15.9,,,
8/8/2006,2006-08-08,220,-41.8,,-53.6,-20.8,,-2.3,,-15.3,,-11.9,-52.6,-16.1,0.4,,
8/9/2006,2006-08-09,221,-41.8,,-53.5,-20.8,,-2.2,,-15.2,,-12.4,-53.5,-15.6,,,
8/9/2006,2006-08-09,221,-41.5,0,-53.8,-20.3,>90,-2.2,>90,-14.7,>90,-11.9,-52.3,-15.9,,,
8/10/2006,2006-08-10,222,-42,,-53.9,-21,,-1.6,,-14.2,,-13.8,-54.5,-16.6,0.4,,
8/10/2006,2006-08-10,222,-41.8,0,-53.6,-20.8,>90,-2.3,>90,-15.3,>90,-11.9,-52.6,-16.1,,,
8/11/2006,2006-08-11,223,-41.8,0,-53.5,-20.8,>90,-2.2,>90,-15.2,>90,-12.4,-53.5,-15.6,,,
8/11/2006,2006-08-11,223,,,,,,,,,,,,,,,
8/12/2006,2006-08-12,224,-43,,-54.5,-24,,-1.8,,-16.3,,-14.2,-54.5,-17.7,0.4,,
8/12/2006,2006-08-12,224,-42,0,-53.9,-21,>90,-1.6,>90,-14.2,>90,-13.8,-54.5,-16.6,,,
8/13/2006,2006-08-13,225,,,,,,,,,,,,,,,
8/14/2006,2006-08-14,226,-44,,-56,-24,,-1.5,,-17.1,,-14.7,-55.9,-18.5,0.4,,
8/14/2006,2006-08-14,226,-43,0,-54.5,-24,>90,-1.8,>90,-16.3,>90,-14.2,-54.5,-17.7,,,
8/15/2006,2006-08-15,227,-44.7,,-56,-24.5,,-1.5,,-17.5,,-15,-55.5,-18.5,0.4,,
8/16/2006,2006-08-16,228,-44,0,-56,-24,>90,-1.5,>90,-17.1,>90,-14.7,-55.9,-18.5,,,
8/16/2006,2006-08-16,228,,,,,,,,,,,,,,,
8/17/2006,2006-08-17,229,-45.5,,-57,-24,,-2.1,,-18.1,,-14.8,-57,-18.5,0.4,,
8/17/2006,2006-08-17,229,-44.7,0,-56,-24.5,>90,-1.5,>90,-17.5,>90,-15,-55.5,-18.5,,,
8/18/2006,2006-08-18,230,-46,,-57.8,-17.2,,-1,,-11.6,,-9.6,>90,-12.6,0.4,,
8/19/2006,2006-08-19,231,-46,,-58.5,-18.2,,-1.3,,-13.5,,-9.9,,-13.4,0.4,,
8/19/2006,2006-08-19,231,-45.5,0,-57,-24,>90,-2.1,>90,-18.1,>90,-14.8,-57,-18.5,,,
8/20/2006,2006-08-20,232,-46,0,-57.8,-17.2,>90,-1,>90,-11.6,>90,-9.6,>90,-12.6,,,
8/20/2006,2006-08-20,232,,,,,,,,,,,,,,,
8/21/2006,2006-08-21,233,-46.5,,-58.5,-20.6,,-1.6,,-16,,-12.2,,-16,0.4,,
8/21/2006,2006-08-21,233,-46,0,-58.5,-18.2,>90,-1.3,>90,-13.5,>90,-9.9,>90,-13.4,,,
8/22/2006,2006-08-22,234,-46.7,,-58.5,-21.6,,-1.7,,-17.1,,-13.5,,-16.9,0.4,,
8/23/2006,2006-08-23,235,-47,,-59,-22,,-2,,-18,,-13.9,,-17.6,0.4,,
8/23/2006,2006-08-23,235,-46.5,0,-58.5,-20.6,>90,-1.6,>90,-16,>90,-12.2,>90,-16,,,
8/24/2006,2006-08-24,236,-47.1,,-59.3,-22.8,,-2,,-18.2,,-14.5,,-18.1,0.4,,
8/24/2006,2006-08-24,236,-46.7,0,-58.5,-21.6,>90,-1.7,>90,-17.1,>90,-13.5,>90,-16.9,,,
8/25/2006,2006-08-25,237,-47,0,-59,-22,>90,-2,>90,-18,>90,-13.9,>90,-17.6,,,
8/26/2006,2006-08-26,238,-47.1,0,-59.3,-22.8,>90,-2,>90,-18.2,>90,-14.5,>90,-18.1,,,
6/13/2007,2007-06-13,164,-25,,-32,-17,>100,4,>100,-21,-35,-10,-30,,0.43,,
6/14/2007,2007-06-14,165,-27,,-28,,>100,4,>100,-16,-36,-10,-28,-20,0.43,,
6/15/2007,2007-06-15,166,-26,,-30,-17,>100,6,>100,-14,-36,-9,-30,-15,0.435,,
6/16/2007,2007-06-16,167,,,-30,-15,>100,5,>100,-13,-38,-8,-30,-15,0.435,,
6/18/2007,2007-06-18,169,-26,,-31,-17,>100,7,>100,-15,-40,-10,-31,-17,0.435,,
6/19/2007,2007-06-19,170,-28,,-29,-17,>100,7,>100,-16,-38,-10,-33,-16,0.435,,
6/22/2007,2007-06-22,173,-28,,-33,-19,>100,5,>100,-17,-40,-11,-33,-17,0.415,,
6/25/2007,2007-06-25,176,-30,,-34,-23,>100,4.5,>100,-22,-38,-14,-34,,0.41,,
6/27/2007,2007-06-27,178,-32,,-35,-19,>100,4.7,>100,-16,-40,-13,-36,-19,0.41,,
6/29/2007,2007-06-29,180,-35,,-38,-21,>100,4.5,>100,-19,-44,-14,-38,-20,0.41,,
7/3/2007,2007-07-03,184,-31,,-39,-24,>100,5,>100,-21,-46,-17,-40,,0.392,,
7/5/2007,2007-07-05,186,-30,,-42,-24,>100,4,>100,-22,-48,-16,-42,,0.39,,
7/9/2007,2007-07-09,190,-36,,-44,-28,>100,4,>100,-23,-60,-19,-62,,0.398,,
7/10/2007,2007-07-10,191,-32,,-45,-24,>100,5,>100,-22,-84,-17,-82,,0.399,,
7/13/2007,2007-07-13,194,-34,,-44,-20,>100,3,>100,-18,>100,-13,>100,-19,0.4,,
7/17/2007,2007-07-17,198,-33,,-47,-21,>100,2,>100,-20,>100,-16,>100,-21,0.405,,
7/19/2007,2007-07-19,200,-37,,-50,-22,>100,4,>100,-22,>100,-16,>100,-22,0.399,,
7/20/2007,2007-07-20,201,-38,,-50,-23,>100,3,>100,-20,>100,-16,>100,-23,0.399,,
7/23/2007,2007-07-23,204,-38,,>100,-24,>100,2,>100,-24,>100,-19,>100,-24,0.398,,
7/25/2007,2007-07-25,206,-37,,>100,-24,>100,2,>100,-24,>100,-20,>100,-23,0.398,,
7/27/2007,2007-07-27,208,-37,,>100,-10,>100,6,>100,-8,>100,-4,>100,-10,0.4,,
7/30/2007,2007-07-30,211,-42,,>100,-10,>100,4,>100,-10,>100,5,>100,-12,0.399,,
7/31/2007,2007-07-31,212,-41,,>100,-10,>100,4,>100,-11,>100,-5,>100,-12,0.399,,
8/2/2007,2007-08-02,214,-38,,>100,-5,>100,5,>100,-6,>100,1.5,>100,-7.5,0.399,,
8/3/2007,2007-08-03,215,-41,,>100,-4,>100,4,>100,-5,>100,0,>100,-7,0.399,,
8/6/2007,2007-08-06,218,-40,,>100,-7,>100,3,>100,-8,>100,-1,>100,-9,0.393,,
8/7/2007,2007-08-07,219,-39,,>100,-8,>100,2,>100,-9,>100,-2,>100,-10,0.395,,
8/9/2007,2007-08-09,221,-40,,>100,-7,>100,3,>100,-6,>100,-1,>100,-8,0.4,,
8/13/2007,2007-08-13,225,-42,,>100,-10,>100,3,>100,-10,>100,-5,>100,-13,0.395,,
8/14/2007,2007-08-14,226,-45,,>100,-7,>100,5,>100,-6,>100,-2,>100,-9,0.41,,
8/16/2007,2007-08-16,228,-45,,>100,-7,>100,3.5,>100,-7,>100,-3,>100,-9,0.395,,
8/18/2007,2007-08-18,230,-45,,>100,-6,>100,3,>100,-7,>100,-1,>100,-8,0.409,,
8/22/2007,2007-08-22,234,-45,,>100,-8,>100,3,>100,-10,>100,-6,>100,-11,0.395,,
8/24/2007,2007-08-24,236,-45,,>100,-11,>100,3,>100,-11,>100,-5,>100,-12,0.395,,
8/27/2007,2007-08-27,239,-48,,>100,-5,>100,3,>100,-7,>100,-2,>100,-8,0.405,,
8/28/2007,2007-08-28,240,-48,,>100,-7,>100,3,>100,-9,>100,-4,>100,-10,0.4,,
8/30/2007,2007-08-30,242,-49,,>100,-9,>100,2,>100,-10,>100,-5,>100,-11,0.396,,
5/17/2008,2008-05-17,138,-12.5,,-17,-2,-12,6,-6,-6,-19,-1,-14,-7,0.41,,
6/1/2008,2008-06-01,153,-17.5,,-18,-8,-12,0,0,-5,-23,-13,-19,-10,0.478,,
6/12/2008,2008-06-12,164,-25,,-26.5,-14,-25.5,4,-4,-8,-32,-8,-28.5,-14,0.47,,
6/13/2008,2008-06-13,165,-23,,-24.5,-13,-24.5,5,-5,-7,-32,-5,-27.5,-13,0.47,,
6/14/2008,2008-06-14,166,-23,,-26.5,-16,-25,9.5,-9.5,-10,-30,-8,-29.5,-16,0.46,,
6/15/2008,2008-06-15,167,-18.5,,-26.5,-12,-28,10.5,-10.5,-6.5,-29,-7.5,-25.5,-11.5,0.465,,
6/16/2008,2008-06-16,168,-24,,-27,-12,-29,9.5,-9.5,-7,-29,-7,-27.5,-12,0.475,,
6/17/2008,2008-06-17,169,-24,,-28,-14,-28,9.5,-9.5,-8,-33,-8,-30.5,-16,0.465,,
6/18/2008,2008-06-18,170,-29.5,,-27.5,-12.5,-28,13,-13,-12.5,-31,-9,-28.5,-4.5,0.465,,
6/19/2008,2008-06-19,171,-26,,-29,-12.5,-27.5,5,-5,-12.5,-34,-9,-29,-15,0.46,,
6/20/2008,2008-06-20,172,-28,,-27,-14,-31,5,-5,-9,-33,-9,-29,-14,0.46,,
6/22/2008,2008-06-22,174,-27,,-30,-9,-31,6,-6,-6,-32.5,-6,-33,-10,0.46,,
6/23/2008,2008-06-23,175,-30,,-30,-9,-33.5,-10,10,-5,-36,-6,-33,-6,0.46,,
6/24/2008,2008-06-24,176,-29,,-29,-6,-34,11,-11,-4,-33.5,-3,-33.5,-7,0.47,,
6/25/2008,2008-06-25,177,-28,,-30,-2.5,-86,13,-13,-2,-40,4,-35,-4,0.485,,
6/26/2008,2008-06-26,178,-29,,-31,-2,>100,12,-12,-2,-40.5,3.5,-44,-1,0.49,,
6/27/2008,2008-06-27,179,-31,,-34.5,-4.5,>100,11,-11,-1.5,-37.5,3,-35.5,-3,0.49,,
6/30/2008,2008-06-30,182,-30,,-35,-4,>100,10,-10,-3,-37,-6,-40,-1,0.475,,
7/1/2008,2008-07-01,183,-30,,-35,-4,>100,9,-9,-3,-35,0,-37,-5.5,0.47,,
7/2/2008,2008-07-02,184,-30,,-36,-6,>100,13,-13,-4,-41,-2,-39.5,-6.5,0.46,,
7/3/2008,2008-07-03,185,-32,,-35,-5,>100,10,-10,-6,-42,-1,-39,-8,0.465,,
7/5/2008,2008-07-05,187,-29,,-39,-10.5,>95,10,-42,-7,-41.5,-2,-39,-9,0.465,,
7/7/2008,2008-07-07,189,-31,,-37.5,-10,>95,3,-40,-6,-43,-6,-39,-11,0.440,,
7/8/2008,2008-07-08,190,-33.5,,-35.5,-11.5,>95,10,-40.5,-6,-42,-7.5,-42,-10.5,0.450,,
7/9/2008,2008-07-09,191,-33,,-41,-13,>95,4,-42,-8.5,-42,-7,-40,-12.5,0.435,,
7/10/2008,2008-07-10,192,-33,,-42,-12.2,>95,9,-50,-8.5,-42,-10,-43,-13,0.430,,
7/14/2008,2008-07-14,196,-34,,-43,-18,>95,0,>95,-10,-46,-12,-43,-19,0.420,,
7/15/2008,2008-07-15,197,-35,,-45,-14,>95,3,>95,-8,-44,-6,-43,-14,0.420,,
7/16/2008,2008-07-16,198,-35,,-43,-13,>95,6,-65,-10,-46,-6.5,-44.5,-13.5,0.415,,
7/17/2008,2008-07-17,199,-35.5,,-43,-13,>95,7,>95,-8,-47.5,-8,-46,-13.5,0.415,,
7/18/2008,2008-07-18,200,-35,,-46,-13,>95,5,>95,-8.5,-48,-8,-45,-11.5,0.420,,
7/21/2008,2008-07-21,203,-36,,-45,-16,>95,0,>95,-11,-50,-11,-48.5,-17,0.415,,
7/22/2008,2008-07-22,204,-38,,-47,-6,>95,9,>95,-2,-54,-4,-50,-7,0.440,,
7/23/2008,2008-07-23,205,-36,,-47,-6,>95,10,>95,-3,-53,-2,>95,-7,0.430,,
7/24/2008,2008-07-24,206,-39,,-49,-6.5,>95,10,>95,-4,-52,-2,>95,-6,0.440,,
7/25/2008,2008-07-25,207,-36,,-49.5,-6,>95,,>95,-5,-55.5,-2,>95,-8,0.440,,
7/27/2008,2008-07-27,209,-36.5,,-50,-8,>95,7,>95,-5.5,-52.5,,>95,-5,0.435,,
7/28/2008,2008-07-28,210,-38.5,,-39,-5.5,>95,7.5,>95,,-50,-5,>95,-8.5,0.435,,
7/29/2008,2008-07-29,211,-38.5,,-52,-7.5,>95,6,>95,-8.5,-55,-3,-73,-8,0.425,,
7/30/2008,2008-07-30,212,-38.5,,-52,-11,>95,10,>95,-8.5,-55,-7,>95,-9,0.430,,
7/31/2008,2008-07-31,213,-35,,-49,-10,>95,2,>95,-7,>95,-5,>95,-13,0.420,,
8/1/2008,2008-08-01,214,-40,,-52.5,-11,>95,8,>95,-9,>95,-5,>95,-12,0.420,,
8/4/2008,2008-08-04,217,-41,,>95,-14.5,>95,6,>95,-11,-90,-8,>95,-16.5,0.410,,
8/5/2008,2008-08-05,218,-41,,>95,-15,>95,5,>95,-12,>95,-7,>95,-17,0.450,,
8/6/2008,2008-08-06,219,-43,,>95,-15,>95,3,>95,-14,>95,-10,>95,-17,0.410,,
8/7/2008,2008-08-07,220,-41,,-121,-17,>130,3,>130,-14,>130,-13,>130,-20,0.410,,
8/8/2008,2008-08-08,221,-42,,-120,-16,>130,2,>130,-15,>130,-15,>130,-17,0.400,,
8/11/2008,2008-08-11,224,-42,,>130,-19,>130,3,>130,-17,>130,-17,>130,-19,0.395,,
8/12/2008,2008-08-12,225,-42,,>130,-17,>130,3,>130,-17,>130,-18,>130,-20,0.395,,
8/13/2008,2008-08-13,226,-41,,>95,-18,>95,2,>95,-23,>95,-18,>95,-20,0.405,,
8/14/2008,2008-08-14,227,-43,,>130,-15,>130,2,>130,-13,>130,-16,>130,-9,0.410,,
8/15/2008,2008-08-15,228,-43.5,,>95,-17,>95,2,>95,-13,>95,-17.5,>95,-13,0.410,,
8/18/2008,2008-08-18,231,-43,,>95,-18,>95,3,>95,-21,>95,-15,>95,-21,0.405,,
8/19/2008,2008-08-19,232,-43,,>130,-15,>130,2,>130,-13,>130,-12,>130,-17,0.410,,
8/20/2008,2008-08-20,233,-43,,>130,-12,>130,2,>130,-12,>130,-8,>130,-15,0.410,,
8/21/2008,2008-08-21,234,-43,,>130,-15,>130,2,>130,-14,>130,-10,>130,-16,0.400,,
8/22/2008,2008-08-22,235,-44,,>130,-11,>130,2,>130,-12,>130,-8,>130,-14,0.410,,
9/16/2008,2008-09-16,260,-47,,>130,-18.5,>130,0,>130,-10,>130,-13,>130,-8,0.395,,
9/26/2008,2008-09-26,270,-47,,>130,-11,>130,1,>130,-10,>130,-13,>130,-8,0.405,,
5/18/2009,2009-05-18,138,-16,,-17.5,-10,-20,14,-14,-4,-17,-11,-23,-3,0.44,,
5/19/2009,2009-05-19,139,-16,,-20,-11,-21,11,-11,-5,-23,-3,-19,-11,0.44,,
5/20/2009,2009-05-20,140,-18,,-22,-11,-23,11,-11,-6,-25,-3,-21,-12,0.445,,
5/21/2009,2009-05-21,141,-21,,-23,-11,-22,11,-11,-5,-25,-3,-22,-12,0.45,,
5/22/2009,2009-05-22,142,-20,,-23,-10,-23,13,-13,-5,-24,-4,-22,-11,0.455,,
5/25/2009,2009-05-25,145,-20,,-25,-8,-25.5,12,-12,-3,-28,-2,-24,-9,0.455,,
5/26/2009,2009-05-26,146,-22,,-22,-9,-26,12.5,-12.5,-4,-28,-2,-24,-10,0.46,,
5/27/2009,2009-05-27,147,-22,,-25.5,-8,-26,16,-16,-4,-28.5,-2,-27,-9,0.465,,
5/28/2009,2009-05-28,148,-22,,-27,-4,-26,16,-16,-4,-31,8,-27,-5,0.48,,
5/29/2009,2009-05-29,149,-24,,-28.5,-5,-29,15,-15,-2,-33.5,0,-26,-6,0.485,,
6/2/2009,2009-06-02,153,-22,,-27,-7,-32,15,-15,-2,-34,0,-26,-7,0.495,,
6/3/2009,2009-06-03,154,-24,,-27.5,-8,-30,13,-13,-3,-34,0,-26,-7,0.495,,
6/4/2009,2009-06-04,155,-24,,-27,-7,-29.5,16,-16,-3,-34.5,-1,-28,-7,0.49,,
6/5/2009,2009-06-05,156,-24,,-28.5,-6,-30,17,-17,-3,-34,-2,-30,-7,0.49,,
6/8/2009,2009-06-08,159,-24,,-29,-8,-30,9,-9,-3,-34,-1,-30,-9,0.485,,
6/9/2009,2009-06-09,160,-25.5,,-31,-9,-29.5,9,-9,-4,-34,-2,-30.5,-9,0.48,,
6/10/2009,2009-06-10,161,-25.5,,-29,-6,-30.5,10.5,-10.5,-5.5,-35,-2,-30,-9,0.475,,
6/11/2009,2009-06-11,162,-24,,-30,-7.5,-29,10,-10,-4.5,-34,-2,-30.5,-9,0.475,,
6/12/2009,2009-06-12,163,-25.5,,-32,-10,-31,8,-8,-5,-36,-2.5,-33,-10,0.47,,
6/13/2009,2009-06-13,164,-25.5,,-31.5,-4,-32,10,-10,-1.5,-40,3,-34,-4,0.48,,
6/16/2009,2009-06-16,167,-27,,-35,-5,-33,12,-12,-1.5,-40,2,-34.5,-6,0.47,,
6/17/2009,2009-06-17,168,-27,,-34,-6,-34,9,-9,-4,-40,0,-33,-6,0.47,,
6/18/2009,2009-06-18,169,-26,,-35,-7,-34,14,-14,-3,-40,-1,-35,-6,0.47,,
6/22/2009,2009-06-22,173,-27.5,,-35.5,-9,-34.5,10,-10,-6,-38,-4,-35,-9,0.485,,
6/23/2009,2009-06-23,174,-29,,-35.5,-12,-37,14,-14,-8,-38,-5,-34,-12,0.445,,
6/24/2009,2009-06-24,175,-28,,-36,-12,-36,9,-9,-9,-40,-5,-36,-12,0.44,,
6/26/2009,2009-06-26,177,-28,,-37,-14,-35.5,8,>95,-9,-41.5,-8,-37.5,-15,0.41,,
6/27/2009,2009-06-27,178,-30,,-39,-16,-39,10,>95,-10,-43,-9,-38,-16,0.435,,
6/29/2009,2009-06-29,180,-30,,-37,-17,>95,5,>95,-12,-43,-10,-40,-16,0.41,,
6/30/2009,2009-06-30,181,-30,,-39,-20,>95,8,>95,-14,-42,-12,-39,-18,0.42,,
7/1/2009,2009-07-01,182,-30,,-38,-19,>95,8,>95,-11,-42,-12,-40,-18,0.41,,
7/3/2009,2009-07-03,184,-31,,-40,-18,>95,6,>95,-12,-44.5,-12,-40,-17,0.42,,
7/5/2009,2009-07-05,186,-31,,-41,-20,>95,7,>95,-16,-45,-15,-43,-20,0.4,,
7/6/2009,2009-07-06,187,-32,,-42,-19,>95,6,>95,-16,-45,-11,-41,-18,0.41,,
7/7/2009,2009-07-07,188,-30,,-41,-18,>95,8,>95,-15,-44.5,-13,-40,-20,0.4,,
7/8/2009,2009-07-08,189,-31.5,,-41.5,-20,>95,7,>95,-16,-47.5,-12,-41,-19,0.4,,
7/9/2009,2009-07-09,190,-36,,-42,-22,>95,7,>95,-17,-44,-16,-42,-20,0.39,,
7/10/2009,2009-07-10,191,-32.5,,-44,-17,>95,7,>95,-12,-46,-13,-43,-17,0.41,,
7/13/2009,2009-07-13,194,-34,,-44,-20,>95,6,>95,-13,-48,-14,-44,-19,0.39,,
7/14/2009,2009-07-14,195,-34,,-46,-23,>95,4,>95,-15,-48,-17,-44,-22,0.39,,
7/16/2009,2009-07-16,197,-36,,-45,-19,>95,8,>95,-12,-49,-12,-44,-17,0.39,,
7/17/2009,2009-07-17,198,-36,,-50,-20,>95,,>95,-17,-50,-14,-44,-20,0.38,,
7/20/2009,2009-07-20,201,-35,,-47,-21,>95,-2,>95,-17,-74,-18,-45,-22,0.38,,
7/21/2009,2009-07-21,202,-42.5,,-47,-23,>95,-5,>95,-19,-52.5,-16.5,-45,-21.5,0.375,,
7/22/2009,2009-07-22,203,-34.5,,-47.5,-23,>95,5,>95,-22,-55.5,-18,-47.5,-23,0.375,,
7/23/2009,2009-07-23,204,-36.5,,-47,-22,>95,3,>95,-22,-38.5,-18,-46,-23,0.375,,
7/24/2009,2009-07-24,205,-35.5,,-48,-23.5,>95,3,>95,-22,-54,-19.5,-48.5,-22,0.38,,
7/26/2009,2009-07-26,207,-37,,-47.5,-23.5,>95,3.5,>95,-27.5,-92,-20,-48,-22,0.385,,
7/27/2009,2009-07-27,208,-33,,-48.5,-20,>95,6,>95,-22.5,>95,-20,-48,-22,0.385,,
7/28/2009,2009-07-28,209,-35,,-50,-17.5,>95,8.5,>95,-14,>95,-12,>95,-18,0.39,,
7/31/2009,2009-07-31,212,-38,,-53,-23,>95,5,>95,-20,>95,-17,>95,-20,0.4,,
8/3/2009,2009-08-03,215,-41,,-52,-26,>95,0,>95,-22,>95,-18,>95,-25,0.39,,
8/4/2009,2009-08-04,216,-42,,-51,-25,>95,0,>95,-24,>95,-20,>95,-23,0.385,,
8/5/2009,2009-08-05,217,-42,,-53,-25,>95,-3,>95,-30,>95,-19,>95,-24,0.38,,
8/10/2009,2009-08-10,222,-43,,>95,-23,>95,2,>95,-23,>95,-17,>95,-22,0.38,,
8/11/2009,2009-08-11,223,-45,,>95,-16,>95,2,>95,-16,>95,-15,>95,-19,0.39,,
8/14/2009,2009-08-14,226,-45,,>95,-12,>95,1,>95,-13,>95,-9.5,>95,-16,0.38,,
8/18/2009,2009-08-18,230,-46,,>95,-11,>95,0,>95,-13,>95,-8,>95,-15,0.37,,
10/3/2009,2009-10-03,276,-53,,>95,-16,>95,0,>95,-17,>95,-14,>95,-18,0.37,,
6/2/2010,2010-06-02,153,-19.0,,-21.0,-4.0,,,-19.0,-4.0,-26.5,,-22.0,-5.0,0.46,,
6/3/2010,2010-06-03,154,-20.0,,-22.0,-4.0,,,-24.5,-3.5,-26.0,,-24.0,-5.0,,,
6/5/2010,2010-06-05,156,-19.8,,-25.0,-6.0,,,-25.0,-4.0,-28.0,,-24.0,-6.0,0.45,,
6/6/2010,2010-06-06,157,-19.0,,-22.0,-7.0,,,-22.0,-4.0,-29.0,,-24.0,-6.0,0.45,,
6/8/2010,2010-06-08,159,-20.0,,-23.0,-6.0,-25.0,11.0,-24.5,-4.0,-28.5,-1.0,-25.0,-7.5,0.45,,
6/9/2010,2010-06-09,160,-19.0,,-24.0,-7.5,-25.0,8.5,-25.0,-5.0,-29.0,-1.0,-28.0,8.5,0.45,,
6/10/2010,2010-06-10,161,-21.5,,-25.5,-8.0,-25.0,-8.0,-26.5,-4.5,-29.5,-1.0,-26.0,-8.0,0.45,,
6/11/2010,2010-06-11,162,-21.5,,-26.0,-9.5,-26.0,12.0,-29.0,-5.5,-31.5,-3.0,-25.5,-8.5,0.44,,
6/13/2010,2010-06-13,164,-23.5,,-27.0,-7.5,-27.0,15.0,-25.5,-2.0,-32.0,0.0,-26.5,-7.0,0.44,,
6/14/2010,2010-06-14,165,-22.0,,-27.5,-6.0,-28.5,14.5,-32.0,-2.5,-33.5,0.0,-28.0,-7.0,0.44,,
6/15/2010,2010-06-15,166,-22.5,,-28.0,-8.0,-28.5,7.0,-27.0,-4.0,-32.0,-1.0,-30.5,-7.0,0.45,,
6/16/2010,2010-06-16,167,-24.5,,-28.5,-7.0,-30.0,16.0,-31.0,-5.5,-33.0,-1.0,-29.0,-7.5,0.45,,
6/17/2010,2010-06-17,168,-23.5,,-30.0,-8.0,-30.5,15.5,-30.5,-5.0,-32.0,1.0,-29.0,-7.5,0.45,,
6/18/2010,2010-06-18,169,-24.0,,-29.5,-8.0,-30.0,13.0,-31.5,-6.0,-32.0,-1.0,-29.0,-8.0,0.45,,
6/19/2010,2010-06-19,170,-25.0,,-30.0,4.0,-33.0,10.0,-34.5,1.0,-36.0,2.0,-32.0,4.0,0.46,,
6/21/2010,2010-06-21,172,-25.5,,-32.5,-2.0,-34.0,12.0,-35.0,-0.5,-39.0,5.0,-32.5,-3.0,0.48,,
6/22/2010,2010-06-22,173,-23.5,,-30.0,-4.0,-34.0,12.0,-34.5,0.0,-39.0,4.0,-32.5,-3.0,0.49,,
6/23/2010,2010-06-23,174,-25.5,,-31.0,-5.0,-34.5,12.0,-33.0,-1.0,-38.5,4.0,-33.0,-4.0,0.49,,
6/24/2010,2010-06-24,175,-25.0,,-31.0,-5.0,-35.0,20.0,-30.0,-1.0,-39.5,1.5,-31.5,-4.5,0.48,,
6/25/2010,2010-06-25,176,-25.0,,-32.0,-6.0,-36.0,12.0,-36.0,-2.0,-39.5,0.0,-32.5,-5.0,0.48,,
6/28/2010,2010-06-28,179,-28.0,,-32.5,-6.0,-36.5,12.5,-37.5,-2.0,-40.0,0.0,-34.5,-5.0,0.47,,
6/29/2010,2010-06-29,180,-28.0,,-35.0,-6.0,-36.5,13.0,-37.0,-2.0,-40.5,0.0,-35.0,-5.0,0.47,,
6/30/2010,2010-06-30,181,-28.0,,-33.5,-5.0,-37.5,13.0,-36.0,-2.0,-39.5,0.0,-35.5,-5.0,0.46,,
7/1/2010,2010-07-01,182,-27.5,,-35.5,-6.0,-38.0,13.0,-38.0,-3.0,-42.0,-0.5,-36.5,-6.0,0.45,,
7/2/2010,2010-07-02,183,-27.5,,-36.5,-6.0,-40.0,13.0,-38.0,-3.0,-42.5,-1.0,-35.0,-6.5,0.45,,
7/5/2010,2010-07-05,186,-29.0,,-38.5,-7.0,-41.5,12.0,-41.5,-3.0,-42.5,-0.5,-38.5,-6.0,0.45,,
7/6/2010,2010-07-06,187,-29.0,,-39.0,-6.5,-43.0,11.0,-39.5,-2.5,-43.0,-0.5,-39.0,-6.0,0.45,,
7/8/2010,2010-07-08,189,-30.0,,-38.0,-7.5,-44.5,11.0,-42.0,-3.5,-44.0,-1.0,-40.0,-7.0,0.43,,
7/9/2010,2010-07-09,190,-30.0,,-39.5,-8.0,>95,12.0,-42.0,-3.5,-43.0,-1.0,-39.5,-7.5,0.44,,
7/12/2010,2010-07-12,193,-31.5,,-43.0,-9.0,>95,,-46.5,-4.0,-48.5,-1.0,-41.0,-8.0,0.43,,
7/13/2010,2010-07-13,194,-30.5,,-43.5,-8.0,>95,11.0,-43.5,0.4,-47.0,-1.5,-42.5,-7.5,0.43,,
7/14/2010,2010-07-14,195,-31.5,,-41.5,-5.5,>95,12.5,-48.0,-1.0,-51.0,-1.0,-41.0,-7.5,0.43,,
7/19/2010,2010-07-19,200,-33.0,,-45.0,-4.0,>95,11.0,-47.5,-0.5,-53.0,2.0,-45.0,-3.5,0.43,,
7/20/2010,2010-07-20,201,-34.0,,-45.5,-4.5,>95,-11.5,-47.0,-1.0,-51.0,0.0,-45.0,-4.0,0.43,,
7/21/2010,2010-07-21,202,-34.0,,-45.0,-5.0,>95,11.0,-47.5,-1.5,-53.0,0.0,-44.5,-4.5,0.42,,
7/23/2010,2010-07-23,204,-25.5,,-47.5,-4.5,>95,12.0,-50.0,,-54.5,0.0,-47.0,-4.0,0.42,,
7/26/2010,2010-07-26,207,-34.0,,-49.0,-6.0,>95,13,-50.5,-2.0,-58.5,0.0,-44.5,-5.0,0.42,,
7/27/2010,2010-07-27,208,-35.0,,-49.0,-8.5,>95,15.0,-81.0,-6.5,-58.0,-2.0,-48.5,-8.5,0.43,,
7/28/2010,2010-07-28,209,-35.5,,-50.5,-8.5,>95,13.5,>95,-3.0,-58.5,-3.0,-48.5,-8.5,0.42,,
7/29/2010,2010-07-29,210,-36.0,,-48.5,-10.0,>95,14.0,>95,-3.5,-60.0,-1.5,-47.0,-8.5,0.42,,
8/4/2010,2010-08-04,216,-38.5,,-52.0,-8.0,>95,10.0,>95,-3.0,-60.0,-2.0,-51.0,-8.0,0.45,,
8/5/2010,2010-08-05,217,-37.8,,-51.5,-12.5,>95,15.0,>95,-4.5,>95,-4.5,-53.0,-9.5,0.45,,
8/10/2010,2010-08-10,222,-39.0,,-52.5,-12.0,>95,12.5,>95,-7.5,>95,-7.5,-52.5,-11.5,0.46,,
9/8/2010,2010-09-08,251,-37.0,,-52.5,-13.0,>95,12.0,>95,-6.5,>95,-7.0,-52.5,-12.0,0.45,,
5/19/2011,2011-05-19,139,-17,,-20,6,-23,22,-12,-6,,,,,0.47,,
5/22/2011,2011-05-22,142,-20,,-22,-10,-21,20,-19,-8,-30,20?,,,0.49,,
5/31/2011,2011-05-31,151,-21,,-33,-8,-25,24,-23,-7,-34,-18,,,0.47,,
6/7/2011,2011-06-07,158,-21.5,,-24.5,-9,-27.5,9,-23.5,-5,-27.5,-2,21.5,-6,0.45,,
6/8/2011,2011-06-08,159,-20,,-26.5,-8,-28.5,9,-22.5,-7,-28.45,-2,26.5,-6,0.45,,
6/9/2011,2011-06-09,160,-21,,-28.5,-9,-30.5,10,-24,-8,-30,-1,26.5,-7,0.45,,
6/10/2011,2011-06-10,161,-23,,-27.5,-9,-31.5,11,-25,-8,-31,-2,26.5,-8,0.45,,
6/13/2011,2011-06-13,164,-22,,-28.5,-10,-89,13,-31,-6,-30,-13,32,-6,0.41,,
6/15/2011,2011-06-15,166,-26,,-31,-14,,14,-30.5,<-10,-36,<-10,31,-13,0.44,,
6/16/2011,2011-06-16,167,-26.5,,-32.5,-14,inf,12,-31,<-10,-36,<-10,29,-15,0.43,,
6/17/2011,2011-06-17,168,-26.5,,-33,-15,inf,11,-31.5,<-10,-35.5,<-10,30.5,-14,0.43,,
6/19/2011,2011-06-19,170,-28,,-34,-18,inf,14,-31.5,<-10,-35,<-10,31.5,-18,0.41,,
6/21/2011,2011-06-21,172,-27.5,,-33.5,-4,inf,10,-32,-2,-37.5,-0.5,33,-5,0.43,,
6/22/2011,2011-06-22,173,-27,,-43,-2,inf,11,-68.5,-2,-43,6,68.5,-2,0.56,,
6/23/2011,2011-06-23,174,-28,,-36,0.5,inf,12,inf,-2,-44,4,35,-3,0.46,,
6/26/2011,2011-06-26,177,-30,,-38,-6,inf,13,inf,-4,-42.45,0,35,-5,0.45,,
6/28/2011,2011-06-28,179,-31,,-38.5,-6,inf,12,inf,-5.5,-41.5,-0.5,38,-4.5,0.44,,
6/30/2011,2011-06-30,181,-30,,-41.5,-5,inf,12,inf,-5,-44.5,0,39,-5,0.44,,
7/4/2011,2011-07-04,185,-32,,-43,-8,inf,10,inf,-8,-46,-2,40,-8,0.53,,
7/5/2011,2011-07-05,186,-36,,-43,-9,inf,10,inf,-7,-43,-3,42,-6,0.41,,
7/6/2011,2011-07-06,187,-31.5,,-44,-10,inf,10,inf,-9,-48.5,-3,41,-10,0.52,,
7/7/2011,2011-07-07,188,-33.5,,-45,-11,inf,10,inf,-10,-46,-5,42.5,-9,0.44,,
7/11/2011,2011-07-11,192,-34,,-47.5,-12,inf,9,inf,-10,-51,-7,inf,-9,0.46,,
7/13/2011,2011-07-13,194,-35.6,,-48,-30,inf,30,inf,<-10,-51,-8,inf,-12,0.46,,
7/14/2011,2011-07-14,195,-35,,-47.5,-14,inf,10,inf,<-10,-53,-7,inf,-12,0.46,,
7/15/2011,2011-07-15,196,-36,,-49.5,-11,inf,10,inf,-9.5,-52,-5,inf,-12,0.46,,
7/16/2011,2011-07-16,197,-37.5,,-48.5,-13,inf,10,inf,<-10,inf,-7,inf,-12.5,0.46,,
7/19/2011,2011-07-19,200,-34.5,,-51,-11,inf,12,inf,-8,inf,-5,inf,-9,0.46,,
7/20/2011,2011-07-20,201,-38.5,,-50,-9,inf,12,inf,-8,inf,-4,inf,-9,0.46,,
7/21/2011,2011-07-21,202,-37,,-50,-7,inf,12,inf,-7,inf,-3,inf,-8,0.45,,
7/22/2011,2011-07-22,203,-38,,-50,-8,inf,10,inf,-9,inf,-3,inf,-8,0.46,,
7/25/2011,2011-07-25,206,-41,,-55,-5,inf,12,inf,-4,inf,1,inf,-4,0.46,,
7/26/2011,2011-07-26,207,-40,,-54,-5,inf,12,inf,-5,inf,0,inf,-4.5,0.46,,
7/27/2011,2011-07-27,208,-42,,-54.5,-4.5,inf,13,inf,-3.5,inf,0.5,inf,-5,0.46,,
7/28/2011,2011-07-28,209,-41,,-55.5,-5,inf,12,inf,-4.5,inf,-0.5,inf,-5,0.46,,
7/30/2011,2011-07-30,211,-41,,inf,-9,inf,12,inf,-9,inf,-2,inf,-8,0.45,,
8/1/2011,2011-08-01,213,-44,,-59,-10,inf,10,inf,<--10,inf,-7,inf,-10,0.44,,
8/2/2011,2011-08-02,214,-42.5,,inf,-11,inf,8,inf,<-10,inf,-9,inf,-11,0.44,,
8/3/2011,2011-08-03,215,,,inf,-12,inf,10,inf,<-10,inf,-9,inf,-12,0.44,,
8/4/2011,2011-08-04,216,-46,,inf,-13,inf,10,inf,-13,inf,-11,inf,-15,0.42,,
8/8/2011,2011-08-08,220,-46,,inf,-13,inf,8,inf,-11,inf,-13,inf,-15,0.42,,
8/9/2011,2011-08-09,221,-49,,inf,-18,inf,9,inf,-13,inf,-13,inf,-17,0.42,,
8/11/2011,2011-08-11,223,-47,,inf,-18,inf,9,inf,-13,inf,-13,inf,-17,0.42,,
8/14/2011,2011-08-14,226,-48.5,,inf,-18,inf,10,inf,-13,inf,-14,inf,-18,0.415,,
8/15/2011,2011-08-15,227,-47,,inf,-19,inf,10,inf,-13,inf,-13,inf,-18,0.41,,
8/17/2011,2011-08-17,229,-48.5,,inf,-20,inf,10,inf,-13,inf,-13,inf,-22,0.42,,
8/22/2011,2011-08-22,234,-49,,inf,-20,inf,10,inf,-13,inf,-13,inf,-20,0.4,,
8/23/2011,2011-08-23,235,-50,,inf,-18,inf,10,inf,-13,inf,-13,inf,-20,0.41,,
8/24/2011,2011-08-24,236,-50,,inf,-20,inf,9,inf,-13,inf,-13,inf,-22,0.41,,
8/25/2011,2011-08-25,237,-50,,inf,-21,inf,10,inf,-13,inf,-13,inf,-21,0.41,,
8/26/2011,2011-08-26,238,-51,,inf,-22,inf,9,inf,-13,inf,-14,inf,-23,0.4,,
8/27/2011,2011-08-27,239,-50,,inf,-13,inf,10,inf,-13,inf,-12,inf,-15,0.41,,
8/30/2011,2011-08-30,242,-51,,inf,-6,inf,11,inf,-7,inf,-4,inf,-8,0.43,,
9/1/2011,2011-09-01,244,-52,,inf,-8,inf,11,inf,-9,inf,-6,inf,-9,0.43,,
9/5/2011,2011-09-05,248,-52,,inf,-15,inf,11,inf,-13,inf,-12,inf,-13,0.42,,
9/7/2011,2011-09-07,250,-51,,inf,-12,inf,9,inf,-13,inf,-9,inf,-13,0.41,,
9/8/2011,2011-09-08,251,-55,,inf,-7,inf,10,inf,-11,inf,-7,inf,-11,0.42,,
9/9/2011,2011-09-09,252,-51.5,,inf,-4,inf,11,inf,-5,inf,-2,inf,-7,0.42,,
9/12/2011,2011-09-12,255,-52,,inf,-6,inf,11,inf,-9,inf,-5,inf,-9,0.42,,
9/13/2011,2011-09-13,256,-53,,inf,-3,inf,13,inf,-4,inf,-1,inf,-7,0.42,,
9/14/2011,2011-09-14,257,-55,,inf,-4,inf,13,inf,-7,inf,-3,inf,-5,0.43,,
9/15/2011,2011-09-15,258,-55,,inf,-3,inf,13,inf,-3,inf,-2,inf,-5,0.43,,
9/23/2011,2011-09-23,266,-54,,inf,-2,inf,14,inf,-3,inf,-1,inf,-4,0.435,,
9/28/2011,2011-09-28,271,-55,,inf,-4,inf,14,inf,-5,inf,-3,inf,-6,0.425,,
10/3/2011,2011-10-03,276,-56,,inf,-3,inf,13,inf,-5,inf,-2,inf,-6,0.42,,
10/7/2011,2011-10-07,280,-57,,inf,-1,inf,12,inf,-2,inf,0,inf,-2,0.43,,
10/9/2011,2011-10-09,282,-58,,inf,-2 ice,inf,13 ice,inf,-3 ice,inf,-1 ice,inf,-4 ice,0.43,,
10/11/2011,2011-10-11,284,-55,,inf,-2,inf,13,inf,-4,inf,-1,inf,-5,0.43,,
10/14/2011,2011-10-14,287,-56,,inf,-5,inf,12,inf,-4,inf,-3,inf,-6,0.42,,
10/19/2011,2011-10-19,292,-57,,inf,-4,inf,12,inf,-2,inf,-3,inf,-4,0.43,,
10/20/2011,2011-10-20,293,-57,,inf,-3,inf,13,inf,-3,inf,-1,inf,-4,0.43,,
10/26/2011,2011-10-26,299,-56,,inf,-5,inf,ice,inf,-7,inf,-3,inf,-8,0.43,,
10/27/2011,2011-10-27,300,-55,,inf,-4 ice,inf,13,inf,-6,inf,-4 ice,inf,-7,0.43,,
11/3/2011,2011-11-03,307,-57,,inf,-3,inf,14,inf,-4,inf,-2,inf,-5,0.44,,
11/7/2011,2011-11-07,311,-57,,inf,-3,inf,14,inf,-4,inf,-3,inf,-5,0.44,,
11/9/2011,2011-11-09,313,-57,,inf,-5,inf,13,inf,-5,inf,-3,inf,-6,0.44,,
11/14/2011,2011-11-14,318,-56,,inf,-6,inf,14,inf,-5,inf,-3,inf,-7,0.44,,
11/18/2011,2011-11-18,322,-57,,inf,-4,inf,15,inf,-5,inf,-2,inf,-6,0.45,,
11/21/2011,2011-11-21,325,-57,,inf,-4 ice,inf,ice,inf,-5 ice,inf,-3 ice,inf,-7 ice,0.45,,
11/24/2011,2011-11-24,328,-58,,inf,-5 ice,inf,ice,inf,-5 ice,inf,-3 ice,inf,-6 ice,0.44,,
11/30/2011,2011-11-30,334,-57,,inf,-5 ice,inf,ice,inf,-3 ice,inf,-4 ice,inf,-8 ice,0.45,,
5/29/2012,2012-05-29,150,-18,,-16,-6,-23,13,-16,-4,-18,-2.5,-19,-6,0.42,,
5/30/2012,2012-05-30,151,-17,,-16,-6,-25,16.5,-15.5,-4,-18.5,-2.5,-16,-6,0.43,,
5/31/2012,2012-05-31,152,-19.5,,-16.5,-5,-25,12,-28,-4,-21,-3,-16.5,-6,0.42,,
6/1/2012,2012-06-01,153,-19.5,,-16.5,-5,-25,15.5,-16,-3.5,-20.5,-2.5,-17,-5.5,0.44,,
6/2/2012,2012-06-02,154,-19.5,,-17,-4,-24,15,-18.5,-5,-21,-2.5,-18.5,-5,0.445,,
6/3/2012,2012-06-03,155,-19.5,,-20.5,-5,-25,16,-17,-5,-21.5,-2,-20.5,-5,0.46,,
6/4/2012,2012-06-04,156,-19.5,,-19.5,-6,-26,17,-17,-5,-20,-2,-19.5,-7,0.46,,
6/6/2012,2012-06-06,158,-20.5,,-23.5,-6,-26.5,13,-19.5,-5,-22,-3,-20.5,-4.5,0.48,,
6/9/2012,2012-06-09,161,-23,,-24.5,-6,-24,15,-20,-5,-25,-2.5,-21.5,-6,0.49,,
6/10/2012,2012-06-10,162,-23,,-25,-7,>-95,-13,-20,-3,-23.5,-5,-22.5,-7,0.49,,
6/12/2012,2012-06-12,164,-23.5,,-25,-3.5,>-95,15.5,-24,-4,-26,-2,-24,-3.5,0.5,,
6/14/2012,2012-06-14,166,-23.5,,-25,-5,>-95,20,-23.5,-4.5,-25.5,-2,-24,4,0.49,,
6/15/2012,2012-06-15,167,-26,,-27.5,1.5,>-95,16,-25.5,-1,-29,-1,-26.5,-2.5,0.49,,
6/17/2012,2012-06-17,169,-25.5,,-25.5,-3,>-95,18.5,-23.5,-1.5,-28.5,-1,-26.5,-3,0.485,,
6/19/2012,2012-06-19,171,-26.5,,-26.5,-2,>-95,21.5,-25,-2,-29.5,-1,-26,-3,0.48,,
6/20/2012,2012-06-20,172,-26.5,,-31,-1,>-95,17,-31,-0.5,-32,4,-29,-2,0.49,,
6/21/2012,2012-06-21,173,-26.5,,-30.5,-2,>-95,,-29.5,0,-34.5,5,-29,-2,0.49,,
6/26/2012,2012-06-26,178,-27,,-30,-3,>-95,13,-85,-2,-32.5,-0.5,-30,-4.5,0.47,,
6/27/2012,2012-06-27,179,-28,,-33,-4,>-95,13,>-95,-3,-35,-2,-32.5,-6,0.465,,
6/28/2012,2012-06-28,180,-30,,-33.5,-6,>-95,12,>-95,-3.5,-34.5,-2,-32,-5,0.46,,
6/30/2012,2012-06-30,182,-29,,-33,-8,>-95,15,>-95,-5,-34.5,-4,-33,-8,0.46,,
7/2/2012,2012-07-02,184,-31,,-34.5,-7,>-95,10,>-95,-3,-35,-3,-32,-3,0.46,,
7/5/2012,2012-07-05,187,-30,,-38,-9,>-95,8,>-95,-7,-36.5,-6,-38,-9,0.46,,
7/6/2012,2012-07-06,188,-31,,-39,-10,>-95,9,>-95,-8,-37,-7,-38.5,-10,0.45,,
7/8/2012,2012-07-08,190,-32,,-37.5,-13,>-95,9.5,>-95,-9,-36,-9,-36.5,-11,0.44,,
7/10/2012,2012-07-10,192,-32.5,,-39.5,-9,>-95,"Fråga niklas, -1? ",>-95,-6,-39,-7,-36.5,-9,0.455,,
7/11/2012,2012-07-11,193,-32.5,,-41,-11,>-95,-10,>-95,-8,-38,-8,-39,-9,0.45,,
7/12/2012,2012-07-12,194,-34,,-41,-10.5,>-95,13,>-95,-8.5,-40,-8,-38.5,-9.5,0.44,,
7/13/2012,2012-07-13,195,-33.5,,-40,-5,>-95,7.5,>-95,-4,-40.5,-3,-39.5,-5,0.46,,
7/16/2012,2012-07-16,198,-35,,-42.5,0,>-95,17,>-95,0,-43.5,1,-41.5,0,0.515,,
7/17/2012,2012-07-17,199,-35.5,,-45,-2,>-95,15,>-95,0,-46,0,-45,-3,0.52,,
7/19/2012,2012-07-19,201,-35,,-45,-1,>-95,15,>-95,0,-46,0,-42,-2,0.5,,
7/20/2012,2012-07-20,202,-35,,-46.5,0,>-95,14,>-95,0,-45.5,0,>-95,0,0.5,,
7/23/2012,2012-07-23,205,-36.5,,-47.5,-3,>-95,13,>-95,0,-48.5,0,>-95,-2,0.49,,
7/24/2012,2012-07-24,206,-36,,-45.5,-3,>-95,15,>-95,-2,-44.5,-1,>-95,-3,0.485,,
7/25/2012,2012-07-25,207,-36,,>-95,-3.5,>-95,14,>-95,-3,-48.5,-1,>-95,-4,0.47,,
7/30/2012,2012-07-30,212,-37,,>-95,-4,>-95,16,>-95,-2,-49.5,-1,>-95,-4,0.48,,
7/31/2012,2012-07-31,213,-39,,>-95,-3,>-95,12,>-95,-3,-52.5,0,>-95,-5,0.48,,
8/1/2012,2012-08-01,214,-37,,>-95,-2,>-95,16,>-95,-2,-50,0,>-95,-2,,,
8/2/2012,2012-08-02,215,-39,,>-95,-4,>-95,11,>-95,-4,>-95,-3,>-95,-4,38,,
8/6/2012,2012-08-06,219,-39.5,,>-95,-3,>-95,10,>-95,-2,>-95,-1,>-95,-3,38,,
8/7/2012,2012-08-07,220,-39.5,,>-95,-3,>-95,13,>-95,-2.5,>-95,-1,>-95,-3,38,,
8/8/2012,2012-08-08,221,-40,,>-95,-2,>-95,12,>-95,-2,>-95,0,>-95,-2,38,,
5/30/2013,2013-05-30,150,-20.5,,-21.5,-14,-28.5,20,-25,-5,-23,-10,-25,-9,39,,
5/31/2013,2013-05-31,151,-20,,-23.5,-15,-28.5,15,-26,-6,-25.5,-12,-26,<-12,39,,
6/3/2013,2013-06-03,154,-22,,-27,-16,-30,13,-28,-9,-29,-11,-28,<-12,39.5,,
6/4/2013,2013-06-04,155,-22.5,,-26,-13,-32,13,-28,-5,-26,-9,-28,-9,40,,
6/5/2013,2013-06-05,156,-23,,-26,-15,-32,13,-28,<-10,-26,<-12,-28,<-13,39,,
6/7/2013,2013-06-07,158,-23,,-29,-16,-33,15,-28.5,-10,-27.5,<-12,-28.5,<-12,39,,
6/10/2013,2013-06-10,161,-24,,-31,-7,-34.5,10,-31,-4.5,-29.5,-5,-31,-5,39,,
6/11/2013,2013-06-11,162,-25,,-29.5,-10,-35,12,-32,-4,-29,-6,-32,-7,39,,
6/12/2013,2013-06-12,163,-27,,-32,-11.5,-35.5,15,-33.5,-8.5,-32,-9,-33.5,-8.5,39,,
6/14/2013,2013-06-14,165,-28,,-33,-15,-38,16,-34,<-10,-33,<-11,-34,<-11,30,,
6/17/2013,2013-06-17,168,-27.5,,-31.5,-13,-41,17,-35,-10,-32.5,-10,-35,-11,38,,
6/18/2013,2013-06-18,169,-29,,-34,-12,-40.5,16,-35.5,-9,-34,-9,-35.5,-9.5,38,,
6/19/2013,2013-06-19,170,-28,,-33.5,-12.5,,12,-37,-10,-34,-9,-37,-10,38,,
6/20/2013,2013-06-20,171,-26.5,,-34.5,-15,,11,-36.5,<-10,-36,<-10,-36.5,<-10,37,,
6/24/2013,2013-06-24,175,-29.5,,-36,-10,,11,-39,-7,-35.5,-7,-39,-7,38,,
6/26/2013,2013-06-26,177,-31,,-37,-11,,10.5,-40,-8,-36,-8,-40,-8.5,37,,
6/27/2013,2013-06-27,178,-31,,-38,-13,,10.5,-40.5,-9,-37,-10,-40.5,-10,37,,
7/1/2013,2013-07-01,182,-32,,-40.5,-15,,10,-41,<-10,-38,<-10,-41,<-10,37,,
7/2/2013,2013-07-02,183,-32,,-41,-12,,10,-43.5,-8,-39,-9,-43.5,-9,37,,
7/3/2013,2013-07-03,184,-33,,-42,-2,,12,-43.5,0,-42,0,-43.5,-2,38,,
7/5/2013,2013-07-05,186,-34.5,,-43.5,-5,,11,-44,-4,-41,-2,-44,-3,37,,
7/8/2013,2013-07-08,189,-34,,-45.5,-7,,11,,-5,-44,-5,,-4.5,37,,
7/9/2013,2013-07-09,190,-36,,-46.5,-6.5,,11,,-3,-45,-3.5,,-5,38,,
7/11/2013,2013-07-11,192,-36,,-48,-8,,11,,-5,-46.5,-5,,-6,37,,
7/15/2013,2013-07-15,196,-36.5,,-48,-3.5,,11,,-2.5,-49,-2,,-3.5,37,,
7/16/2013,2013-07-16,197,-38,,-48.5,-3.5,,11,,-2,-50,-1.5,,-4,40,,
7/17/2013,2013-07-17,198,-39,,-50,-4,,11,,-2.5,-50,-2,,-3,37,,
7/18/2013,2013-07-18,199,-39,,-49.5,-5,,10.5,,-3,-50.5,-2,,-4,37,,
7/19/2013,2013-07-19,200,-39,,-50,-4,,11.5,,-3,-51,-2,,-3.5,37,,
7/22/2013,2013-07-22,203,-38,,-52,-6,,18.5,,-4,-53.5,-5,,-4,36,,
7/23/2013,2013-07-23,204,-39,,-53.5,-7,,10,,-7,-54.5,-7,,-7,36,,
7/24/2013,2013-07-24,205,-38,,-48,-9,,10,,-7,-51.5,-7,,-7,?,,
7/25/2013,2013-07-25,206,-41,,-51,-10.5,,10,,-7,-51.5,-7,,-7,?,,
7/29/2013,2013-07-29,210,-41,,<-67,-9,,9.5,,-8,-54,-10,,-9,?,,
7/30/2013,2013-07-30,211,-42,,,-11,,9.5,,-8,-54.5,-9,,-10,36.5,,
7/31/2013,2013-07-31,212,-42,,,-11,,9.5,,-8,-57,-10,,-10,37,,
8/1/2013,2013-08-01,213,-42,,,-10,,9.5,,-8,-57,-9,,-9,37,,
8/12/2013,2013-08-12,224,-47,,,-11,,9.5,,-8,,-10.5,,-10,37.5,,
8/13/2013,2013-08-13,225,-47.5,,,-12,,10,,-9,,-10,,-10,38,,
8/15/2013,2013-08-15,227,-47,,,-14.5,,9.7,,<-10,,<-12,,<-11,37.5,,
8/19/2013,2013-08-19,231,-49,,,-3.5,,10,,-2.5,,-2,,-2.5,3.8,,
8/20/2013,2013-08-20,232,-48.5,,,-5,,9.5,,-5,,-2,,-4,37,,
8/21/2013,2013-08-21,233,-49,,,-5.5,,9,,-5,,-3,,-5,37,,
8/23/2013,2013-08-23,235,-51.5,,,-7,,9,,-6,,-7,,-6,36.5,,
8/27/2013,2013-08-27,239,-50.5,,,-13,,9,,-10,,-11,,<-10,38,,
8/28/2013,2013-08-28,240,-50.5,,,-13,,9,,-10,,-11,,-11,38,,
8/30/2013,2013-08-30,242,-51,,,-13,,8.5,,<-10,,<-12,,<-11,37,,
9/1/2013,2013-09-01,244,-51,,,-14,,8.5,,<-10,,<-12,,<-11,37,,
9/2/2013,2013-09-02,245,-51,,,-16.5,,8.5,,<-11,,<-12,,<-11,36,,
9/3/2013,2013-09-03,246,-51,,,-16,,8,,<-11,,<-12,,<-11,36,,
9/6/2013,2013-09-06,249,-51.5,,,-18,,8,,<-11,,<-12,,<-11,35.5,,
9/9/2013,2013-09-09,252,-51.5,,,-18,,8,,<-11,,<-12,,<-11,36,,
9/11/2013,2013-09-11,254,-52,,,-17,,8,,-11,,<-12,,<-11,36,,
9/12/2013,2013-09-12,255,-52.5,,,-17,,8,,<-11,,<-12,,<-11,36,,
9/13/2013,2013-09-13,256,-52.5,,,-18.5,,8,,<-11,,<-12,,<-11,36,,
9/16/2013,2013-09-16,259,-53,,,-19,,7.5,,<-11,,<-12,,<-11,35,,
9/17/2013,2013-09-17,260,-53,,,-20,,7.5,,<-11,,<-12,,<-11,35,,
9/19/2013,2013-09-19,262,-53.5,,,-18,,7.5,,<-11,,<-12,,<-11,35.5,,
9/23/2013,2013-09-23,266,-54.5,,,-2,,10.5,,-1,,-2,,-3,37,,
9/25/2013,2013-09-25,268,-54.5,,,-4,,9.5,,-3,,-3,,-5,37,,
9/26/2013,2013-09-26,269,-55.5,,,-5,,9.5,,-3.5,,-4,,-5,37,,
9/30/2013,2013-09-30,273,-55,,,-7.5,,9,,-6,,-6,,-6.5,36,,
10/1/2013,2013-10-01,274,-55,,,-7.5,,9,,-6,,-6,,-5,36.5,,
2014/06/05,2014-06-05,156,-20.5,,-21,-14,-23,8,-22.5,-12,-21,-13,-23.5,-9,38,,
2014/06/06,2014-06-06,157,-23,,-26.5,-11.5,-23,9,-24,-11.5,-24,-11,-23.5,-9,39,,
2014/06/09,2014-06-09,160,-24.5,,-29,-12,>-80,9,>-80,-12,-26,-10,-26,-8.5,40,,
2014/06/10,2014-06-10,161,-23,,-30,-9,,9,,-12.5,-25,-8.5,-25.5,-8,40,,
2014/06/11,2014-06-11,162,-24,,-29.5,-11.5,,19,,-14,-27,-9,,-8,38,,
2014/06/12,2014-06-12,163,-23.5,,-31,-11.5,,8,,-14,-27.5,-9.5,,-9,40,,
2014/06/16,2014-06-16,167,-24.5,,-33,-10,,9.5,,-12,-30,-9,,-8.5,-,,
2014/06/17,2014-06-17,168,-26,,-29,-8.5,,10,,-11,-25.5,-8,,-7.5,39,,
2014/06/19,2014-06-19,170,-24.5,,,-9,,9.5,,-13,-30.5,-7.5,,-8.9,38,,
2014/06/23,2014-06-23,174,-26.5,,,-9,,9,,-13.5,-13,-7,,-7.5,38,,
2014/06/25,2014-06-25,176,-26.5,,,-10.5,,10,,-14,-31,-9,,-9.5,39,,
2014/06/30,2014-06-30,181,-28,,,-15,,10,,-1,-36,-10,,-10.5,38,,
2014/07/06,2014-07-06,187,-31.5,,,10,,8,,14.5,-41,7,,9,-,,
2014/07/11,2014-07-11,192,-31.6,,,-15,,9,,-17,-42,-20,,-12,28,,
2014/07/14,2014-07-14,195,-32,,,-19,,8,,-19,-45,-9,,-9,too much sedge,,
2014/07/17,2014-07-17,198,-36.5,,,-7,,9.5,,-11,,-5,,-6,,,
2014/07/22,2014-07-22,203,-41,,,-14,,7.5,,-16,,-12.5,,-10,,,
2014/07/28,2014-07-28,209,-39.5,,,-17,,5.5,,-17,,-13,,-12,,,
2014/08/04,2014-08-04,216,-43,,,-20,,5,,-7.5,,-15,,-12,,,
2014/08/06,2014-08-06,218,-51,,,-12,,7,,-17,,-17,,-10,,,
2014/08/12,2014-08-12,224,-45.5,,,-17,,6,,-20,,-16,,-13,,,
2014/08/17,2014-08-17,229,-46.5,,,-9,,7,,-13.5,,-8,,-7.5,,,
2014/08/20,2014-08-20,232,,,,,,,,,,,,,,,
2014/08/27,2014-08-27,239,-47.5,,,-8,,7,,-13,,-9,,-8,,,
2014/08/29,2014-08-29,241,-49,,,-18,,5.5,,19,,-18,,-16,,,
2014/09/02,2014-09-02,245,-51.8,,,-20,,5,,19,,-19,,-17,,,
2014/09/05,2014-09-05,248,-50.6,,,-19,,4,,21,,-19,,-18,,,
2014/09/10,2014-09-10,253,-52.5,,,-16,,4.5,,21,,-16,,-15,,,
2014/09/16,2014-09-16,259,-53,,,-21,,4,,20,,-17,,-17,,,
2014/09/18,2014-09-18,261,-53,,,-20,,4,,20,,-19.5,,-18,,,
2014/09/23,2014-09-23,266,-54.5,,,-10,,4.5,,16,,-10,,-9.5,,,
6/3/2015,2015-06-03,154,-20,,-24.5,0.4,-23.5,.,-17, ,-11,-7.5,-25.5, ,,,
6/5/2015,2015-06-05,156,-18.2,,-24.5, ,,0.4,-18.7, ,-22.3,-7.5,-23, ,,,
6/7/2015,2015-06-07,158,-21.5,,-20.5, ,-26.5, ,-26.7, ,-20.5,-8,-23.33,-9,,,
6/8/2015,2015-06-08,159,-21,,-22, ,-28, ,-25, ,-20.5,-5,-23.5,-10,,,
6/9/2015,2015-06-09,160,-23.5,,-26.5, ,-27, ,-20.5, ,-23,-6,-24,-9.5,,,
6/14/2015,2015-06-14,165,-26,,-23, ,,,-25, ,-24.5,-7,-24,-15,,,
6/15/2015,2015-06-15,166,-20.5,,-23,5,, ,-24.5, ,-23,-7,-25.5,-12,,,
6/16/2015,2015-06-16,167,-21,,-26, ,,10,-21,7.5,-23.5,-8,-25,-12,,,
6/17/2015,2015-06-17,168,-25.5,,-27.5, ,,10,-26,8,-23.5,-7.5,-25,-13.5,,,
6/18/2015,2015-06-18,169,-24,,-24.5, ,,8,-22.5,7,-24.5,-8,-27.5,-14.5,,,
6/20/2015,2015-06-20,171,-24.5,,-27.5,,,10,-26,8.5,-24,-10,-26.5,-15,,,
6/21/2015,2015-06-21,172,-23.5,,-23.5,,,13,-24.5,-5,-23,-7.5,-25.5,-13,,,
6/22/2015,2015-06-22,173,-25,,-28.5,,,10,-28.5,-9,-26.5,-11,-29,-16,,,
6/23/2015,2015-06-23,174,-26.5,,-29,,,9,-28.5,-4,-27.5,-5.5,-29,-10,,,
6/24/2015,2015-06-24,175,-25,,-27.5,6,,11,-31,-2,-28.5,-4,-29.5,-4,,,
6/26/2015,2015-06-26,177,-27,,-29,7,,12,-30,-2,-29,-3,-31,-3,,,
6/27/2015,2015-06-27,178,-27,,-33,2,,10,-31,-2,-31,-9,-33,-9,,,
6/29/2015,2015-06-29,180,-26.5,,-34,2,,11,-35.5,-5,-31,-6,-32.5,-9.5,,,
6/30/2015,2015-06-30,181,-26,,-31,1.5,,10.5,-36.5,-5,-30.5,-7,-33.5,-10,,,
7/1/2015,2015-07-01,182,-26.9,,-33.5,1,,9.5,-29,-6,-31,-5,-33,-9.5,,,
7/2/2015,2015-07-02,183,-25.5,,-32,1,,10,-38,-6,-31,-6,-35,-4,,,
7/4/2015,2015-07-04,185,-29.5,,-32.5,3,,11,,-4,-33,-7,-35.5,-8,,,
7/6/2015,2015-07-06,187,-28,,,1,,11,,-4,-34,-8,-37,-11,,,
7/9/2015,2015-07-09,190,-31,,,2,,10,,-4,-35,-6,-37,-7,,,
7/10/2015,2015-07-10,191,-31,,,1.2,,10,,-3,-36,-5,-39,-8,,,
7/11/2015,2015-07-11,192,-30,,,4,,10,,-3,-37,-6,-39,-9,,,
7/13/2015,2015-07-13,194,-31.5,,,1,,10,,-5,-38.5,-6,-40.5,-11,,,
7/17/2015,2015-07-17,198,-35.5,,,0,,10,,-8,-42,-7,-43,-12,,,
7/18/2015,2015-07-18,199,-35.5,,,0.5,,10,,-7,-40.5,-7,-43.5,-11,,,
7/19/2015,2015-07-19,200,-34,,,0,,11,,-6.5,-43,-6,-43.5,-12,,,
7/21/2015,2015-07-21,202,-34,,,3.5,,-11,,-3,-43,-5,-44,-7,,,
7/22/2015,2015-07-22,203,-34,,,3,,10,,-5,-43,-4,-46.5,-8,,,
7/26/2015,2015-07-26,207,-34.5,,,1,,10,,-5,-45,-5,-49,-9,,,
7/27/2015,2015-07-27,208,-35,,,5,,9,,-3,,-4,,-4,,,
7/28/2015,2015-07-28,209,-38,,,3,,10,,-3,,-5,,-6,,,
7/30/2015,2015-07-30,211,-38,,,7,,11,,-2,,-3,,-7,,,
8/2/2015,2015-08-02,214,-42,,,5,,13,,-2,,-3.5,,-7,,,
8/4/2015,2015-08-04,216,-42,,,3,,11,,-3,,-5,,-6,,,
8/5/2015,2015-08-05,217,-42,,,2,,11,,-3,,-3,,-4,,,
8/7/2015,2015-08-07,219,-42.5,,,2,,8,,-4,,-5,,-7,,,
8/9/2015,2015-08-09,221,-40,,,1,,11,,-4,,-5,,-9,,,
8/12/2015,2015-08-12,224,-44,,,2,,10,,-3,,-4,,-9,,,
8/13/2015,2015-08-13,225,-44,,,0,,10,,-3.5,,-7,,-10,,,
8/17/2015,2015-08-17,229,-47,,,-1,,,,-5,,-6,,-11,,,
8/20/2015,2015-08-20,232,-47.5,,,,,11,,-8,,-9,,-10,,,
8/24/2015,2015-08-24,236,-49,,,-5,,9,,-9,,-9,,-13,,,
8/25/2015,2015-08-25,237,-47.5,,,-5,,,,-8,,-9,,-10,,,
8/31/2015,2015-08-31,243,-50.5,,,-5,,12,,-7,,-7,,-11,,,
9/3/2015,2015-09-03,246,-54,,,-13,,8.5,,-7,,-5,,-7,,,
9/7/2015,2015-09-07,250,-53,,,-5,,10,,-7,,-7,,-11,,,
9/10/2015,2015-09-10,253,-53.5,,,-5,,8,,-8,,-12,,-13,,,
9/14/2015,2015-09-14,257,-54,,,-10,,,,-11,,-11,,-15,,,
9/15/2015,2015-09-15,258,-54.5,,,-5,,8,,-9,,-10,,-15,,,
9/16/2015,2015-09-16,259,-53,,,-8,,8,,-9,,-11,,-16,,,
9/23/2015,2015-09-23,266,-55.5,,,3,,9,,-4,,-5,,-8,,,
9/24/2015,2015-09-24,267,-55,,,3,,10,,-6,,-5,,-8,,,
7/1/2016,2016-07-01,183,-28,,,,,,,,,,,-8,,,
7/3/2016,2016-07-03,185,-31,,,,,,,,,,,-5,,,
7/5/2016,2016-07-05,187,-30,,,,,10,,7,,,,,,,
7/11/2016,2016-07-11,193,-32,,,-5,,11,,,,,,2,,,
7/14/2016,2016-07-14,196,-33,,,-7,,19.5,,,,,,3.5,,,
7/16/2016,2016-07-16,198,-33,,,-6,,19,,,,,,2,,,
7/19/2016,2016-07-19,201,-33.5,,,-5,,10.5,,,,,,2,,,
7/21/2016,2016-07-21,203,-34.5,,,-7,,10,,,,,,3,,,
8/9/2016,2016-08-09,222,-42,,,,,,,,,,,,,,
8/12/2016,2016-08-12,225,-42,,,-5.5,,9,,,,,,2,,,
9/18/2016,2016-09-18,262,-82,,,-11,,9,,,,0,,7,,,
6/13/2017,2017-06-13,164,-19.5,,-25,-7,,12,,-3,-29,2,-25,-7,,-20.5,
6/15/2017,2017-06-15,166,-21.5,,-28,-8,,11,,-4,,-1,,-2.5,,-21,
6/23/2017,2017-06-23,174,-24,,,-9,,9,,-5,,-2.5,,-2.5,,-25.5,
7/1/2017,2017-07-01,182,-26,,,-7,,11,,-6,,-1,,-2,,-29,
7/6/2017,2017-07-06,187,-23,,,-9,,10,,-6,,-1,,-3,,-29,
7/16/2017,2017-07-16,197,-30,,,-8,,11,,-6,,0,,-2,,-32.5,
7/21/2017,2017-07-21,202,-28,,,-9,,10,,-6,,-6,,-2,,-35,
7/29/2017,2017-07-29,210,-28.5,,,-12,,10,,-11,,-2,,-5,,-35.5,
8/4/2017,2017-08-04,216,-31,,,-8,,10.5,,-8,,-1,,-3,,-38,
8/9/2017,2017-08-09,221,-33,,,-8,,10.5,,-9,,-1,,-3,,-37,
8/16/2017,2017-08-16,228,-32.5,,,-11,,9.5,,-11,,-1,,-4,,-39.5,
8/23/2017,2017-08-23,235,-35.7,,,-9,,10,,-10,,-1,,-2,,-43,
8/28/2017,2017-08-28,240,-33,,,-10,,10,,-12,,-1,,-2,,-40,
9/8/2017,2017-09-08,251,-34,,,-13,,9,,-13,,-2,,-4,,-45,
9/16/2017,2017-09-16,259,-35.5,,,-11,,9.5,,-13,,-1,,-3,,-43,
9/20/2017,2017-09-20,263,-36,,,-13,,9,,-13,,-2,,-3,,-46.5,
9/26/2017,2017-09-26,269,-36,,,-14,,9,,-14,,-2,,-4,,-48,
10/8/2017,2017-10-08,281,-47,,,-11.5,,10,,-12,,-2,,-4,,-53,
10/23/2017,2017-10-23,296,-45,,,0,,0,,0,,0,,0,,-52,
6/2/2018,2018-06-02,153,-17,,-22,0,-30,14,-21,-11,-28,2.5,-25,-4,,-18,
